{
  "$schema": "../schemas/toolchain-lock.schema.json",
  "schema_version": "1.0",
  "runtime": {
    "python": {
      "constraint": ">=3.12",
      "source": "https://www.python.org/"
    },
    "pydantic": {
      "constraint": "==2.13.4",
      "source": "https://pypi.org/project/pydantic/"
    },
    "typer": {
      "constraint": "==0.27.0",
      "source": "https://pypi.org/project/typer/"
    }
  },
  "development": {
    "hypothesis": {
      "constraint": "==6.165.0",
      "source": "https://pypi.org/project/hypothesis/"
    },
    "jsonschema": {
      "constraint": "==4.26.0",
      "source": "https://pypi.org/project/jsonschema/"
    },
    "pyright": {
      "constraint": "==1.1.411",
      "source": "https://pypi.org/project/pyright/"
    },
    "pytest": {
      "constraint": "==8.4.2",
      "source": "https://pypi.org/project/pytest/"
    },
    "pytest-cov": {
      "constraint": "==6.3.0",
      "source": "https://pypi.org/project/pytest-cov/"
    },
    "ruff": {
      "constraint": "==0.16.1",
      "source": "https://pypi.org/project/ruff/"
    },
    "uv": {
      "constraint": "==0.12.1",
      "source": "https://pypi.org/project/uv/"
    }
  },
  "security": {
    "gitleaks": {
      "constraint": "==8.30.1",
      "source": "https://github.com/gitleaks/gitleaks/releases/tag/v8.30.1"
    },
    "grype": {
      "constraint": "==0.116.1",
      "source": "https://github.com/anchore/grype/releases/tag/v0.116.1"
    },
    "osv-scanner": {
      "constraint": "==2.5.0",
      "source": "https://github.com/google/osv-scanner/releases/tag/v2.5.0"
    },
    "semgrep": {
      "constraint": "==1.172.0",
      "source": "https://github.com/semgrep/semgrep/releases/tag/v1.172.0"
    },
    "syft": {
      "constraint": "==1.50.0",
      "source": "https://github.com/anchore/syft/releases/tag/v1.50.0"
    }
  }
}
